alien_trespass|Brian Orndorf|BrianOrndorf.com|F|The patience and concentration of the film to not wink itself into a coma is amazing to behold, and I was flabbergasted over just how engrossing and playful the picture is.|B|June 2, 2010|N
alien_trespass|Wesley Lovell|Cinema Sight|R|Not nearly as awful as it could have been...it at least knows that it's cheesy, which makes it more fun.|2.5/4|December 12, 2009|N
alien_trespass|Karina Montgomery|Cinerina|R|It's not really clear why this movie was necessary %u2013 it does not reinvent the 50's movie so much as do a highly faithful cover version of it. (Gus Van Sandy's shot-for-shot remake of Psycho is a similar pointless academic exercise.)|2/5|May 31, 2009|N
alien_trespass|Maitland McDonagh|Miss FlickChick|F|If imitation is the sincerest form of flattery, It Came From Outer Space should be blushing like a schoolgirl, because this deadpan recreation of 1950s sci-fi movies is a tribute to its low-budget, high minded charms.|NA|April 29, 2009|N
alien_trespass|Sara Michelle Fetters|MovieFreak.com|R|The simple fact is that this movie kind of drove me nuts, and the only emotion it consistently brought out of me was an almost overwhelming desire for the darn thing to come to an end.|2/4|April 15, 2009|N
alien_trespass|Frank Ochieng|Movie Eye|F|...gently wacky. Although breezy and sketchy on the easy laughs at times, Alien Trespass does promise to entertain for the sole purpose of its campy off-kilter makeup.|2.5/4|April 15, 2009|N
alien_trespass|Tim Brayton|Antagony & Ecstasy|R|If the film succeeds perfectly in its aim, to recreate exactly a genre of films noted for how shoddy and boring they were, is it then fair to complain when the film is itself boring?|6/10|April 8, 2009|N
alien_trespass|Brent Simon|Shared Darkness|R|Neither legit parody nor loving sci-fi homage; a movie with no firm reference point, [and] lacking the breezy wit or clever execution that might otherwise provide a reason for its standalone existence.|D|April 8, 2009|N
alien_trespass|Todd R. Ramlow|PopMatters|R|Alien Trespass won't let our knowledge of the stereotypes it incorporates do the work and make the critique.|1/10|April 7, 2009|N
alien_trespass|Frank Swietek|One Guy's Opinion|R|It doesn't want to be camp, but it inevitably becomes so, because the very effort to replicate its models is so knowing that it comes across as insufferably arch.|C|April 6, 2009|N
alien_trespass|Avi Offer|NYC Movie Guru|F|If you're willing to check your brain at the door and to suspend a lot of your disbelief, Alien Trespass manages to be a delightfully zany and campy satire best experienced at midnight with a group of friends.|6.0/10|April 4, 2009|N
alien_trespass|Robin Clifford|Reeling Reviews|F|The filmmakers have an obvious love for their work and its source material and it shows.|B|April 4, 2009|N
alien_trespass|"Steve ""Uncle Creepy"" Barton"|Dread Central|F|A true love letter to genre days gone by, Alien Trespass delivers on its promise to bring back a slice of the good old days to horror cinema.|3.5/5|April 3, 2009|N
alien_trespass|Steve Rhodes|Internet Reviews|F|While it never rises to the level of Galaxy Quest, my gold standard for funny sci-fi films, Alien Trespass consistently delights and amuses.|3/4|April 3, 2009|N
alien_trespass|James Rocchi|Common Sense Media|R|Retro-style sci-fi action spoof tries hard but doesn't work.|2/5|April 3, 2009|N
alien_trespass|Pete Hammond|Hollywood.com|F|A highly entertaining retro Sci-fi blast from the past that is loads of fun, an endearing tribute to all those bad movies we just loved.|3/5|April 3, 2009|N
alien_trespass|Frank Lovece|Film Journal International|F|Not a spoof, not a satire, just an imaginary story with echoes of It Came from Outer Space and other 1950s drive-in classics, Alien Trespass is a paragon of dry humor.|NA|April 3, 2009|N
alien_trespass|Adam Tobias|Watertown Daily Times|R|... once those warm, fuzzy feelings of nostalgia start to wear off, all you are left with is a tedious movie that is full of wooden performances, campy dialogue, cheesy and outdated special effects, eerie music and space beings in rubber suits.|2.5/5|April 3, 2009|N
alien_trespass|Joe Neumaier|New York Daily News|R|This lazy effort gets points only for truly loving -- perhaps to a fault -- the cheapo creature flicks of the 1950s.|1/5|April 3, 2009|Y
alien_trespass|Stephen Whitty|Newark Star-Ledger|R|It's a satire without laughs, a parody without punch lines, a careful copy that replicates everything except the original's life.|1.5/4|April 3, 2009|Y
alien_trespass|Mike Russell|Oregonian|R|One gets the sinking feeling as Alien Trespass drags on that [director] Goodwin thought he could build a whole movie out of a few formal gags about bad editing.|C|April 3, 2009|N
alien_trespass|Lisa Kennedy|Denver Post|F|It's comfy. It's kitschy. There are lovely enticements but also much that is simply put and beautifully, beguilingly silly.|NA|April 3, 2009|Y
alien_trespass|Cary Darling|Dallas Morning News|R|While there's a lot to admire, it all feels like an engaging though needless academic exercise.|C|April 3, 2009|Y
alien_trespass|Andrea Gronvall|Chicago Reader|R|Sinks under the weight of its homage.|NA|April 3, 2009|Y
alien_trespass|Peter Hartlaub|San Francisco Chronicle|F|How much you enjoy this strange picture depends on two things: Your appreciation of the genre that is being feted here, and the enthusiasm of the audience that you view it with.|3/4|April 3, 2009|Y
alien_trespass|Frank Scheck|Hollywood Reporter|R|By the time the tedious proceedings reach their conclusion, one has long begun wishing for a little Mel Brooks-style comic anarchy.|NA|April 3, 2009|Y
alien_trespass|Chris Hewitt|St. Paul Pioneer Press|F|Alien Trespass is an intriguing experiment, and I admire its craftsmanship.|2.5/4|April 3, 2009|N
alien_trespass|Staci Layne Wilson|Buzzine Magazine|R|Everything is perfected to the letter, but it lacks the oomph of homage movies like Pleasantville, or the fun irony of social satires like Fido.|NA|April 3, 2009|N
alien_trespass|Kurt Loder|MTV|R|If you're not going to have fun with such a silly cinematic subgenre, what's the point in resurrecting it? Or, from the more pertinent audience point of view, in seeing it?|1/5|April 3, 2009|N
alien_trespass|Rob Vaux|Mania.com|R|Fans of the era will respond warmly to it, but more through its expressed affection than any notable assets of its own.|C|April 3, 2009|N
alien_trespass|Jeannette Catsoulis|New York Times|R|A charmingly sentimental but ultimately pointless homage to the sci-fi classics of yesteryear.|2/5|April 3, 2009|Y
alien_trespass|Eugene Novikov|AMCtv.com|F|An affectionate, almost reverent homage to the science fiction of the 1950s: Not a lampoon so much as a faithful recreation.|B|April 3, 2009|N
alien_trespass|Marc Savlov|Austin Chronicle|F||3/5|April 3, 2009|N
alien_trespass|Peter Sobczynski|eFilmCritic.com|R||1/5|April 3, 2009|N
alien_trespass|James Verniere|Boston Herald|F||B|April 3, 2009|N
alien_trespass|Brandon Fibbs|BrandonFibbs.com|R|Fun at first, the movie quickly wears thin. Imitation may be the sincerest form of flattery, but if that's your choice, you better be sure the thing you're imitating is worthy of it.|4/10|April 2, 2009|N
alien_trespass|Eric D. Snider|EricDSnider.com|R|It achieves its hokiness by design, which renders it artificial and flat.|C|April 2, 2009|N
alien_trespass|Betsy Sharkey|Los Angeles Times|R|While Alien Trespass stays true to the era and the genre, it forgets that its mission in this galaxy is not merely to pay tribute but to entertain.|2/5|April 2, 2009|Y
alien_trespass|Claudia Puig|USA Today|R|Alien Trespass, which opens Friday on the heels of the witty Monsters vs. Aliens, feels like an also-ran.|2/4|April 2, 2009|Y
alien_trespass|Nell Minow|Beliefnet|F|"The shrewd script has two of the 1950's primary fixations: the couple who exemplify ""togetherness"" and the teenagers who could be juvenile delinquents."|B|April 2, 2009|N
alien_trespass|John Hartl|Seattle Times|R|Bewildered? You won't be alone.|2/4|April 2, 2009|Y
alien_trespass|Jackie Loohauis|Milwaukee Journal Sentinel|R|To see how Alien Trespass might have been done, rent The Lost Skeleton of Cadavra with its puppet monster on visible strings, its dime-store sets and its dreadful artificial dialogue.|2/4|April 2, 2009|N
alien_trespass|Jan Stuart|Washington Post|R|Those who fondly recall The Blob would seem to be the target crowd for a fastidious pastiche that attempts to coax laughs by maintaining a poker face.|NA|April 2, 2009|Y
alien_trespass|Laura Clifford|Reeling Reviews|F|Perhaps nothing is more lovingly recreated that the glorious technicolor of the time (the film was shot on Super 16), owing as much to production designer Ian D. Thomas's team as the technicians.|B|April 2, 2009|N
alien_trespass|Donald J. Levit|ReelTalk Movie Reviews|R|'Alien Trespass' is neither soulless nor bad. Yet it does not improve on the sources that inspire it, so why not watch them instead?|NA|April 2, 2009|N
alien_trespass|Keith Phipps|AV Club|R|There's no shortage of either the originals or imitators, so why make Alien Trespass, a send-up of second-shelf '50s sci-fi so straight-faced, it could almost pass as the real thing?|D|April 2, 2009|Y
alien_trespass|Amy Nicholson|I.E. Weekly|F|Robert Patrick and Dan Lauria add gravitas as two small town cops, which says it all.|C|April 2, 2009|Y
alien_trespass|Ty Burr|Boston Globe|F|Alien Trespass could be the latest bulletin from Mystery Science Theatre 3000 except that we're the silhouetted heads and the filmmakers are sitting right there next to us.|3/4|April 2, 2009|Y
alien_trespass|Steven Rea|Philadelphia Inquirer|R|At a certain point you find yourself thinking, why not watch the real It Came From Outer Space, instead of this mildly amusing replica?|2.5/4|April 2, 2009|Y
alien_trespass|Matt Pais|Metromix.com|R|A pale imitation of a drive-in movie, with nothing silly or sloppy enough to qualify as camp.|1/5|April 2, 2009|N
alien_trespass|Joe Williams|St. Louis Post-Dispatch|R|Alien Trespass earns some style points, but the substance is Dullsville.|2.5/4|April 2, 2009|Y
alien_trespass|Roger Ebert|Chicago Sun-Times|R|Here is a movie more suited to ComicCon or the World Science Fiction Convention than to your neighborhood multiplex.|2/4|April 2, 2009|Y
alien_trespass|Marshall Fine|Hollywood & Fine|R|Like a lavishly displayed knick-knack, of interest only to its owner. Yes, the display is beautifully rendered %u2013 but, in the end, it's still a knick-knack, no more or less.|NA|April 2, 2009|N
alien_trespass|Alonso Duralde|MSNBC|R|Trafficking in arch, winking jokes that even the laziest improv comics would consider beneath them, Alien Trespass is a handsomely mounted, and occasionally well-acted, snooze.|2/5|April 1, 2009|N
alien_trespass|Lisa Schwarzbaum|Entertainment Weekly|F|That warm tone, along with the picture's bright, saturated, anti-CGI look, is a welcome respite from jokes, irony, and the postmodern malaise of know-it-all-ness.|B|April 1, 2009|Y
alien_trespass|Robert Levin|Critic's Notebook|F|The movie is a curiosity, to be sure, but one fostered by an enjoyably nostalgic spirit.|3/4|April 1, 2009|N
alien_trespass|Nick Pinkerton|Village Voice|R|What's most admirable about Alien Trespass is its bypassing of the wink-wink condescension that usually defines screen flashbacks to the Eisenhower era. Its problem is the absence of any detectable personality in place of that wink.|NA|April 1, 2009|Y
alien_trespass|Nick Schager|The Screengrab|R|Merely coasts along limply, lacking ribald tongue-in-cheek humor as well as the unironic self-seriousness that epitomized its spiritual predecessors.|NA|March 30, 2009|N
alien_trespass|Andrew Schenker|Slant Magazine|R|A pastiche of '50s sci-fi cheapies whose ambitions seem limited to providing some light entertainment for genre geeks.|1.5/4|March 29, 2009|N
alien_trespass|Katey Rich|CinemaBlend|R|"The movie's claim of being a ""forgotten classic"" gets less believable as the effects start looking more realistic."|2/5|March 19, 2009|N
alien_trespass|Cole Smithey|ColeSmithey.com|R|"What starts out as a promising retro comic spoof of '50s era sci-fi movies (think ""It Came From Outer Space"") digresses into a flat imitation of the mores and social ignorance it initially promises to skewer."|C|March 18, 2009|N
alien_trespass|Prairie Miller|NewsBlaze|F|Kooky faux blast from the past eating disorder space monster fugitives craving humans for dinner, sexpot dames with flirty libidos who would make the Hays Code censorship suits faint back then, and memory lane mayhem with humans wielding table salt.|NA|February 5, 2009|N
the_congress|Tom Meek|Cambridge Day|F|...gloriously gonzo.|3/4|August 14, 2020|N
the_congress|Joanne Laurier|World Socialist Web Site|R|In its totality, this is a very uneven work.|NA|August 13, 2020|N
the_congress|Samuel B. Prime|Slant Magazine|F|The Congress is part live action and part Ralph Bakshi fever dream, but all nightmare. It paints a vision of the future where individuality and anything resembling free will is supplanted by delicious chemical cocktails and a candy-coated reversal.|NA|September 24, 2019|N
the_congress|Matthew Lucas|From the Front Row|F|This is an extraordinary film, a unique film, the kind of film that reminds us of the true power of science fiction to comment on our society.|3.5/4|August 7, 2019|N
the_congress|Rachel Wagner|Rachel's Reviews (YouTube)|R|It had a lot of interesting ideas and... it's very well done but I really thought it was very self-indulgent.|NA|July 2, 2019|N
the_congress|Tom Bond|One Room With A View|F|Thrillingly audacious and bursting with ideas, humanity and heart.|5/5|May 25, 2019|N
the_congress|D.W. Mault|CineVue|F|For a film that looks at a believably nightmarish future, The Congress sits out of its time: a feverish relic of a post-revolutionary cinema of the mind.|4/5|April 3, 2019|N
the_congress|Deirdre Crimmins|Film Thrills|R|The film then becomes philosophical posturing with dialogue that is so abstruse it is impossible to tell if they are even trying to cobble together a story.|NA|August 21, 2018|N
the_congress|Brandy McDonnell|The Oklahoman|F|Wright's utterly human performance...grounds the film in matters of the heart, even as the filmmaker concerns himself with tricks of the mind.|4/4|August 7, 2018|N
the_congress|Camilla Long|Sunday Times (UK)|R|It isn't brilliant, outrageous and challenging. But it is pretty and occasionally fun. So go for the first half, then leave.|NA|February 21, 2018|N
the_congress|Pamela Jahn|Electric Sheep|F|The film is a fiercely original, bold and riveting meditation on the future of the silver screen and the stars that make it shine.|NA|September 27, 2017|N
the_congress|Lisa Rosman|Signature|F|In these hyper-dissociative times, [The Congress] may be just what the doctor ordered.|NA|August 4, 2017|N
the_congress|Alex Casey|Flicks.co.nz|F|It flits between hallucinatory animation and 'reality', giving small moments of relief and attempting to anchor the story in a desolate Los Angeles.|4/5|March 10, 2017|N
the_congress|Becky Suter|TheShiznit.co.uk|R|Ari Folman's follow up to the impressive Waltz With Bashir is bold, daringly different and visually arresting, but it's also a bit too much.|2/5|July 11, 2016|N
the_congress|Anton Bitel|FilmLand Empire|F|Both sci-fi and metacinematic documentary, The Congress is a hallucinatory vision of our new wired world - and yet for all its overt artifice, it locates a sense of loss that feels all too real.|NA|February 14, 2015|N
the_congress|Todd Jorgenson|Cinemalogue|R|Some provocative ideas are left unfulfilled in this visually dazzling indictment of Hollywood and technology.|NA|January 9, 2015|N
the_congress|Craig Mathieson|The Sunday Age|R|Folman makes one phantasmagorical leap after another, adding a live-action coda, but the visual freedom doesn't expand the story, it abandons it.|2.5/5|December 10, 2014|N
the_congress|Dennis Schwartz|Dennis Schwartz Movie Reviews|F|Weird sci-fi film that mixes together animation with live action.|B|December 10, 2014|N
the_congress|Sarah Ward|FILMINK (Australia)|F|Crucial to Folman's vision of the material is Wright's star turn, and the baggage that she brings.|NA|December 4, 2014|N
the_congress|Shane Danielsen|sbs.com.au|R|It's an intensely frustrating film, one that veers between excellent and silly in the space of seconds.|2/5|December 4, 2014|N
the_congress|Paul Byrnes|Sydney Morning Herald|F|The weighty ideas are welcome, but Folman dumps them on us in bucketfuls of alphabet soup.|3/5|December 3, 2014|Y
the_congress|Tom Clift|Concrete Playground|R|With more disciplined writing and editing, Folman's cartoon menagerie could have resembled a masterpiece. As it stands, it's an admirable and thought-provoking failure.|2.5/5|November 30, 2014|N
the_congress|Robert Levin|amNewYork|F|A one-of-a-kind vision of the way we live now and a warning shot across the bow of a society slowly submerging itself in technology.|3/4|October 31, 2014|N
the_congress|Graham Young|Birmingham Mail|F|The Congress loses direction when it becomes an animation ( ... ) Israeli director Ari Folman (Waltz With Bashir) at least delivers a unique take on an industry that's not always this keen to be so introspective.|3/5|October 10, 2014|N
the_congress|Tim Brayton|Antagony & Ecstasy|F|While it's certainly a great if wildly inconclusive work of style, [Robin] Wright always pulls it back to being, ultimately, about what human beings feel.|8/10|September 11, 2014|N
the_congress|Ron Wilkinson|Monsters and Critics|F|A great cast gives it their all but are sampled one time too many by Ari Folman's sci-fi monster.|7/10|September 9, 2014|N
the_congress|Zach Hollwedel|Under the Radar|F|One of the oddest movies about movies in a long time.|7/10|September 9, 2014|N
the_congress|David Denby|New Yorker|R|The anger drains out of the picture, and we watch in a state of passive appreciation and indifference.|NA|September 5, 2014|Y
the_congress|Mike Scott|Times-Picayune|R|It boasts big ideas that it wants us to mull over, but Folman's labyrinthine film doesn't so much discuss them in any cohesive way as much as it just points them out.|2/5|September 5, 2014|N
the_congress|John Wirt|Advocate (Baton Rouge, LA)|F|It's a drama, it's a cartoon. It's playful and sad, satirical and moving. All these things and a chaotic visual feast as well.|3/4|September 5, 2014|N
the_congress|Mark Dujsik|Mark Reviews Movies|F|The film begins a stinging critique of Hollywood's less admirable qualities ... It becomes a lament for humanity's inability to deal with the hardships of life and the world.|3/4|September 5, 2014|N
the_congress|Anders Wright|San Diego Union-Tribune|F|Folman has so much to say, and he does it in ways that are smart and beautiful, creating a work that evokes intense emotions that are, at times, difficult to define.|3.5/5|September 4, 2014|N
the_congress|Manohla Dargis|New York Times|F|An acquired taste, this dense Jabberwocky-ish word salad is a political allegory about a populace that's been pharmaceutically duped into believing its wretched world is wonderful.|NA|September 4, 2014|Y
the_congress|Tom Russo|Boston Globe|F|A half-live-action, half-animated headtrip that throws Robin Wright into a dizzying showbiz paradigm shift.|NA|September 4, 2014|Y
the_congress|Lou Lumenick|New York Post|F|A dystopian blend of live-action and animation that acidly comments on some of Hollywood's touchiest issues before drifting off into an existential fog.|3/4|September 3, 2014|Y
the_congress|Elizabeth Weitzman|New York Daily News|R|"It's almost painful to watch the immense promise of ""The Congress,"" Ari Folman's spectacularly ambitious experiment, dissipate into nothing."|2/5|September 3, 2014|Y
the_congress|Keith Uhlich|Time Out|F|It's like Folman took several different genres-Hollywood satire, speculative dystopian fiction, family melodrama-and fused them into something amorphous and nebulous.|4/5|September 2, 2014|Y
the_congress|Scout Tafoya|RogerEbert.com|F|"""The Congress"" is a roll call of the orgiastic pleasures and bountiful comforts that art provides, and, a reminder of what waits for us when we leave the theater."|3.5/4|August 29, 2014|Y
the_congress|Josh Larsen|LarsenOnFilm|F|...flirts with greatness, even if it doesn't quite attain it.|3/4|August 29, 2014|N
the_congress|Geoff Pevere|Globe and Mail|F|There's something to be said for a movie that manages to baffle and dazzle in equal measure. If Daffy Duck had taken up political and media theory, his brain might look like this.|3/4|August 29, 2014|Y
the_congress|Frederic and Mary Ann Brussat|Spirituality & Practice|F|Intriguing story about what it would be like to live in a post-avatar world.|3/5|August 28, 2014|N
the_congress|Bill Gibron|Film Racket|F|a fascinating study in self, and what we think of when we contemplate who we are.|4/5|August 28, 2014|N
the_congress|Robert Abele|Los Angeles Times|F|Ambitiously trippy and compulsively watchable ...|NA|August 28, 2014|Y
the_congress|John Hartl|Seattle Times|R|"""The Congress"" becomes as frustrating and expensive-looking as ""Cloud Atlas."" Try to follow it and you may feel abandoned in a maze."|2.5/4|August 28, 2014|Y
the_congress|Linda Barnard|Toronto Star|R|The Congress will thrill some but proves more often to be frustrating and lacking in emotion, especially when it comes to Wright. Even a sex scene feels devoid of passion.|2/4|August 28, 2014|Y
the_congress|Tomas Hachard|NPR|R|While always detailed in its visual execution, each new aspect of the film's world remains conceptually hollow, growing ultimately into a Matrix-style allegory for the nature of truth ...|NA|August 28, 2014|Y
the_congress|Doris Toumarkine|Film Journal International|R|...The Congress falls victim to heavy-handed flip-flopping as it struggles to incorporate themes like family values and true love into a tacky Hollywood fable full of explosive action and signifying little.|NA|August 28, 2014|N
the_congress|Michael Sragow|Orange County Register|F|The movie is a howl of pain at the technological and corporate takeover of our fantasy lives - and, increasingly, our real lives.|B|August 28, 2014|Y
the_congress|Chris Nashawaty|Entertainment Weekly|R|It spirals into logy animated nonsense.|C|August 28, 2014|Y
the_congress|Kimberley Jones|Austin Chronicle|R|Long on vision but short on coherence, this live-action/animation dyad boasts a stranger kind of duality: As it unspooled, I felt I'd never seen anything quite like it before... and already I was fantasizing about a tighter, less self-serious remake.|2.5/5|August 28, 2014|N
the_congress|Jake Coyle|Associated Press|F|Busting with ideas, from ageism in Hollywood to the soullessness of digital life.|2.5/4|August 28, 2014|Y
the_congress|Amy Nicholson|L.A. Weekly|F|Like its actress, it's an ambitious knockout that doesn't quite live up to its potential|B|August 28, 2014|Y
the_congress|Mike D'Angelo|AV Club|R|It's a folly of the first order, but one that many people will nonetheless want to see, if only because it's so out there.|C|August 28, 2014|Y
the_congress|Matt Prigge|Metro|F|If Folman's script is choppy - it doesn't help having Jon Hamm on retainer as a character who does nothing but explain a confusing world to [Robin] Wright/us - it is smoothed out, as much as it can be, by its star.|4/5|August 27, 2014|N
the_congress|Dan Fainaru|Screen International|F|[Wright] comes through with flying colours, confidently carrying all the live action sequences on her shoulders.|NA|August 26, 2014|N
the_congress|Todd McCarthy|Hollywood Reporter|R|Jettisoning a connection to anything concrete, Folman, who started his career in documentaries, loses his narrative moorings.|NA|August 26, 2014|Y
the_congress|Peter Debruge|Variety|R|Beyond the recurring symbol of her son's red kite, there's little to connect Wright to this hallucinogenic animated space where disgruntled citizens are free to pass as the persona of their choice.|NA|August 26, 2014|Y
the_congress|Chuck Bowen|Slant Magazine|R|As executed by writer-director Ari Folman, the concept is tidy, superficially clever, and almost defiantly irrelevant.|2/4|August 24, 2014|N
the_congress|Laurence Phelan|Independent (UK)|F|The animated dreamworld of the second half is a wonderfully colourful and bizarre place, but so confusing that it is hardly credible that consumers of the future are going to want to pay money to spend time there.|3/5|August 22, 2014|Y
the_congress|Padraic McKiernan|Sunday Independent (Ireland)|F|The psychedelic second section derails the finished product somewhat but it's never less than absorbing. Cult classics have evolved from less.|NA|August 22, 2014|N
the_congress|Rich Cline|Contactmusic.com|F|Fiercely original and wildly ambitious, this provocative drama is often thrilling simply because it's like nothing ever put on-screen.|3.5/5|August 21, 2014|N
the_congress|Henry Barnes|Observer (UK)|F|Folman uses the live action half of his film to champion real acting over motion capture; it's almost fitting that The Congress loses our interest as soon as it drifts into the ethereal.|3/5|August 17, 2014|N
the_congress|Donald Clarke|Irish Times|F|Viewers of a certain age may feel the urge to remove a black vinyl disc from the screen, place it on the turntable and roll fragrant herbs on the brightly coloured surface.|4/5|August 16, 2014|N
the_congress|Andrew Osmond|SFX Magazine|F|A beautiful looking, occasionally brilliant, outrageously indulgent trip.|4/5|August 15, 2014|N
the_congress|Guy Lodge|London Evening Standard|F|Nearly 30 years into her film career, Robin Wright is finally coming into her own, and it's something to see.|3/5|August 15, 2014|Y
